{
  "generated_at": "2026-05-06T11:17:02.174Z",
  "bundle_path": "D:\\Users\\HCI_lab\\Desktop\\github\\飞书比赛\\data\\fixtures\\feishu_cli_case_05_desktop_robot",
  "output_dir": "D:\\Users\\HCI_lab\\Desktop\\github\\飞书比赛\\data\\outputs\\demo\\case05\\prd_indicator_full_run",
  "selected_meeting_id": "MTG-CASE-05-03",
  "trigger_type": "manual",
  "call_model": true,
  "run_status": "failed",
  "run_started_at": "2026-05-06T11:04:28.004Z",
  "run_finished_at": "2026-05-06T11:17:02.168Z",
  "total_duration_ms": 754163,
  "error_message": "fetch failed",
  "front_pipeline": {
    "status": "collected",
    "completeness_status": "ready",
    "blocking_reason_count": 0,
    "degrade_reason_count": 0,
    "selection_attempt_count": 1,
    "fallback_used": false,
    "duration_ms": 95
  },
  "hard_metrics": {
    "metric_quality_report": {
      "sample_counts": {
        "task_count": 30,
        "risk_count": 5,
        "meeting_count": 3,
        "chat_message_count": 50,
        "calendar_event_count": 3,
        "contact_count": 5,
        "base_history_count": 8
      },
      "metric_count": 15,
      "available_count": 15,
      "degraded_count": 0,
      "no_sample_count": 0
    },
    "duration_ms": 3
  },
  "evaluation_plan": {
    "execution_mode": "full_evaluation",
    "duration_ms": 1
  },
  "data_counts": {
    "source_catalog_count": 7,
    "chat_message_count": 50,
    "calendar_event_count": 3,
    "org_contact_count": 5,
    "project_doc_count": 3,
    "meeting_doc_count": 3,
    "base_history_count": 8,
    "recent_meeting_count": 2,
    "risk_history_count": 8,
    "action_item_count": 2,
    "decision_count": 3,
    "meeting_risk_count": 3,
    "provenance_ref_count": 9,
    "hard_metric_count": 15,
    "hard_metric_available_count": 15,
    "hard_metric_degraded_count": 0,
    "hard_metric_no_sample_count": 0,
    "anomaly_sample_count": 8,
    "metric_gap_count": 0,
    "planner_focus_count": 5,
    "planner_agent_count": 5,
    "human_review_rule_count": 5,
    "data_quality_warning_count": 2,
    "data_quality_issue_count": 0
  },
  "observability_issue_count": 0,
  "observability_issues": [],
  "meeting_selection_attempts": [
    {
      "meeting_id": "MTG-CASE-05-03",
      "status": "collected",
      "completeness_status": "ready",
      "blocking_reasons": []
    }
  ],
  "agent_runs": [
    {
      "agent_key": "management_reviewer",
      "display_name": "Management Reviewer",
      "status": "completed",
      "started_at": "2026-05-06T11:04:28.113Z",
      "finished_at": "2026-05-06T11:06:53.995Z",
      "duration_ms": 145882,
      "model_invoked": true,
      "request_file": "D:\\Users\\HCI_lab\\Desktop\\github\\飞书比赛\\data\\outputs\\demo\\case05\\prd_indicator_full_run\\management_reviewer_request.json",
      "result_file": "D:\\Users\\HCI_lab\\Desktop\\github\\飞书比赛\\data\\outputs\\demo\\case05\\prd_indicator_full_run\\management_reviewer_result.json",
      "request_size_bytes": 39168,
      "result_size_bytes": 11825,
      "request_metric_count": 7,
      "request_human_review_rule_count": 2,
      "request_provenance_ref_count": 9,
      "finding_count": 2,
      "risk_flag_count": 0,
      "score_count": 0,
      "human_review_count": 2,
      "key_evidence_count": 0,
      "risk_alert_count": 0,
      "next_action_count": 0,
      "missing_upstream_result_count": 0,
      "error_message": null
    },
    {
      "agent_key": "risk_behavior_auditor",
      "display_name": "Risk & Behavior Auditor",
      "status": "completed",
      "started_at": "2026-05-06T11:04:28.130Z",
      "finished_at": "2026-05-06T11:07:53.150Z",
      "duration_ms": 205020,
      "model_invoked": true,
      "request_file": "D:\\Users\\HCI_lab\\Desktop\\github\\飞书比赛\\data\\outputs\\demo\\case05\\prd_indicator_full_run\\risk_behavior_auditor_request.json",
      "result_file": "D:\\Users\\HCI_lab\\Desktop\\github\\飞书比赛\\data\\outputs\\demo\\case05\\prd_indicator_full_run\\risk_behavior_auditor_result.json",
      "request_size_bytes": 42216,
      "result_size_bytes": 15680,
      "request_metric_count": 6,
      "request_human_review_rule_count": 3,
      "request_provenance_ref_count": 9,
      "finding_count": 3,
      "risk_flag_count": 3,
      "score_count": 0,
      "human_review_count": 3,
      "key_evidence_count": 0,
      "risk_alert_count": 0,
      "next_action_count": 0,
      "missing_upstream_result_count": 0,
      "error_message": null
    },
    {
      "agent_key": "coordination_lens",
      "display_name": "Coordination Lens",
      "status": "completed",
      "started_at": "2026-05-06T11:04:28.131Z",
      "finished_at": "2026-05-06T11:07:02.223Z",
      "duration_ms": 154092,
      "model_invoked": true,
      "request_file": "D:\\Users\\HCI_lab\\Desktop\\github\\飞书比赛\\data\\outputs\\demo\\case05\\prd_indicator_full_run\\coordination_lens_request.json",
      "result_file": "D:\\Users\\HCI_lab\\Desktop\\github\\飞书比赛\\data\\outputs\\demo\\case05\\prd_indicator_full_run\\coordination_lens_result.json",
      "request_size_bytes": 35663,
      "result_size_bytes": 12718,
      "request_metric_count": 2,
      "request_human_review_rule_count": 0,
      "request_provenance_ref_count": 9,
      "finding_count": 3,
      "risk_flag_count": 0,
      "score_count": 0,
      "human_review_count": 1,
      "key_evidence_count": 0,
      "risk_alert_count": 0,
      "next_action_count": 0,
      "missing_upstream_result_count": 0,
      "error_message": null
    },
    {
      "agent_key": "capability_assessor",
      "display_name": "Capability Assessor",
      "status": "degraded",
      "started_at": "2026-05-06T11:07:53.167Z",
      "finished_at": "2026-05-06T11:11:55.143Z",
      "duration_ms": 241976,
      "model_invoked": true,
      "request_file": "D:\\Users\\HCI_lab\\Desktop\\github\\飞书比赛\\data\\outputs\\demo\\case05\\prd_indicator_full_run\\capability_assessor_request.json",
      "result_file": "D:\\Users\\HCI_lab\\Desktop\\github\\飞书比赛\\data\\outputs\\demo\\case05\\prd_indicator_full_run\\capability_assessor_result.json",
      "request_size_bytes": 71131,
      "result_size_bytes": 22806,
      "request_metric_count": 15,
      "request_human_review_rule_count": 2,
      "request_provenance_ref_count": 0,
      "finding_count": 0,
      "risk_flag_count": 0,
      "score_count": 5,
      "human_review_count": 6,
      "key_evidence_count": 0,
      "risk_alert_count": 0,
      "next_action_count": 0,
      "missing_upstream_result_count": 0,
      "error_message": null
    },
    {
      "agent_key": "report_writer",
      "display_name": "Report Writer",
      "status": "failed",
      "started_at": "2026-05-06T11:11:55.156Z",
      "finished_at": "2026-05-06T11:17:02.168Z",
      "duration_ms": 307012,
      "model_invoked": true,
      "request_file": "D:\\Users\\HCI_lab\\Desktop\\github\\飞书比赛\\data\\outputs\\demo\\case05\\prd_indicator_full_run\\report_writer_request.json",
      "result_file": null,
      "request_size_bytes": 108211,
      "result_size_bytes": 0,
      "request_metric_count": 0,
      "request_human_review_rule_count": 0,
      "request_provenance_ref_count": 0,
      "finding_count": 0,
      "risk_flag_count": 0,
      "score_count": 0,
      "human_review_count": 0,
      "key_evidence_count": 0,
      "risk_alert_count": 0,
      "next_action_count": 0,
      "missing_upstream_result_count": 0,
      "error_message": "fetch failed"
    }
  ],
  "files": {
    "task_request": "D:\\Users\\HCI_lab\\Desktop\\github\\飞书比赛\\data\\outputs\\demo\\case05\\prd_indicator_full_run\\task_request.json",
    "orchestration_state": "D:\\Users\\HCI_lab\\Desktop\\github\\飞书比赛\\data\\outputs\\demo\\case05\\prd_indicator_full_run\\orchestration_state.json",
    "input_completeness_report": "D:\\Users\\HCI_lab\\Desktop\\github\\飞书比赛\\data\\outputs\\demo\\case05\\prd_indicator_full_run\\input_completeness_report.json",
    "raw_payload": "D:\\Users\\HCI_lab\\Desktop\\github\\飞书比赛\\data\\outputs\\demo\\case05\\prd_indicator_full_run\\raw_payload.json",
    "history_bundle": "D:\\Users\\HCI_lab\\Desktop\\github\\飞书比赛\\data\\outputs\\demo\\case05\\prd_indicator_full_run\\history_bundle.json",
    "meeting_fact_pack": "D:\\Users\\HCI_lab\\Desktop\\github\\飞书比赛\\data\\outputs\\demo\\case05\\prd_indicator_full_run\\meeting_fact_pack.json",
    "data_quality_report": "D:\\Users\\HCI_lab\\Desktop\\github\\飞书比赛\\data\\outputs\\demo\\case05\\prd_indicator_full_run\\data_quality_report.json",
    "hard_metrics_result": "D:\\Users\\HCI_lab\\Desktop\\github\\飞书比赛\\data\\outputs\\demo\\case05\\prd_indicator_full_run\\hard_metrics_result.json",
    "evaluation_plan": "D:\\Users\\HCI_lab\\Desktop\\github\\飞书比赛\\data\\outputs\\demo\\case05\\prd_indicator_full_run\\evaluation_plan.json",
    "management_reviewer_request": "D:\\Users\\HCI_lab\\Desktop\\github\\飞书比赛\\data\\outputs\\demo\\case05\\prd_indicator_full_run\\management_reviewer_request.json",
    "management_reviewer_result": "D:\\Users\\HCI_lab\\Desktop\\github\\飞书比赛\\data\\outputs\\demo\\case05\\prd_indicator_full_run\\management_reviewer_result.json",
    "risk_behavior_auditor_request": "D:\\Users\\HCI_lab\\Desktop\\github\\飞书比赛\\data\\outputs\\demo\\case05\\prd_indicator_full_run\\risk_behavior_auditor_request.json",
    "risk_behavior_auditor_result": "D:\\Users\\HCI_lab\\Desktop\\github\\飞书比赛\\data\\outputs\\demo\\case05\\prd_indicator_full_run\\risk_behavior_auditor_result.json",
    "coordination_lens_request": "D:\\Users\\HCI_lab\\Desktop\\github\\飞书比赛\\data\\outputs\\demo\\case05\\prd_indicator_full_run\\coordination_lens_request.json",
    "coordination_lens_result": "D:\\Users\\HCI_lab\\Desktop\\github\\飞书比赛\\data\\outputs\\demo\\case05\\prd_indicator_full_run\\coordination_lens_result.json",
    "capability_assessor_request": "D:\\Users\\HCI_lab\\Desktop\\github\\飞书比赛\\data\\outputs\\demo\\case05\\prd_indicator_full_run\\capability_assessor_request.json",